title,author,description,price,stock,image_url,seller_username
The Alchemist,Paulo Coelho,A fable about following your dream.,450.00,20,,john_seller
Atomic Habits,James Clear,An easy and proven way to build good habits.,600.00,15,,john_seller
The Great Gatsby,F. Scott Fitzgerald,A classic novel of the Jazz Age.,350.00,10,,jane_seller
Start with Why,Simon Sinek,How great leaders inspire everyone to take action.,550.00,25,,jane_seller
1984,George Orwell,A dystopian social science fiction novel.,400.00,30,,john_seller
Brave New World,Aldous Huxley,A dystopian novel set in a futuristic World State.,420.00,12,,jane_seller
